Date début;Date fin;Type période;Saison;Séjour minimum;Commentaire
01/01/2026;13/02/2026;Basse saison hiver;Basse;2 nuits;Hors vacances, demande faible, viser week-ends et offres longues
14/02/2026;20/02/2026;Vacances d'hiver zone B;Haute;3 nuits;Zone B (Hauts-de-France, Lille, Amiens...) clientèle locale et familles
21/02/2026;02/03/2026;Vacances d'hiver zones B + C;Très haute;4 nuits;Chevauchement B + C, incluant Paris/Île-de-France, très forte demande
03/03/2026;10/04/2026;Fin hiver / pré-printemps;Basse;2 nuits;Remplissage week-ends, offres couple / télétravail
11/04/2026;17/04/2026;Vacances de printemps zone B;Haute;3 nuits;Familles de la zone B, bonne période nature
18/04/2026;27/04/2026;Vacances de printemps zones B + C;Très haute;4 nuits;B + C en vacances, Baie de Somme très attractive
28/04/2026;30/04/2026;Intersaison printemps;Moyenne;2 nuits;Entre vacances et ponts, prix intermédiaires
01/05/2026;03/05/2026;Pont 1er mai;Haute;3 nuits;Week-end prolongé, tarification renforcée
04/05/2026;07/05/2026;Intersaison mai;Moyenne;2 nuits;Souplesse sur les durées, last-minute
08/05/2026;10/05/2026;Pont 8 mai;Haute;3 nuits;Très forte demande si beau temps
11/05/2026;12/05/2026;Intersaison avant Ascension;Moyenne;2 nuits;Remplir les trous entre ponts
13/05/2026;18/05/2026;Pont Ascension (jours vaqués);Très haute;4 nuits;Période la plus rentable du printemps
19/05/2026;22/05/2026;Pré-Pentecôte;Moyenne;2 nuits;Offres flexibles, prix moyens
23/05/2026;25/05/2026;Week-end Pentecôte;Haute;3 nuits;Séjours 3 nuits à privilégier
26/05/2026;03/07/2026;Pré-été;Moyenne;2 nuits;Météo agréable, cibler couples/seniors
04/07/2026;31/08/2026;Été (toutes zones);Très haute;7 nuits;Haute saison classique, arrivées/départs le samedi
01/09/2026;30/09/2026;Arrière-saison;Moyenne;2 nuits;Publics sans enfants, bons taux de marge
01/10/2026;17/10/2026;Automne;Basse;2 nuits;Demande calme, promotions possibles
18/10/2026;02/11/2026;Vacances Toussaint (toutes zones);Moyenne;3 nuits;Balades nature, séjours famille
03/11/2026;10/11/2026;Après Toussaint;Basse;2 nuits;Très calme, accepter petits séjours
11/11/2026;15/11/2026;Autour du 11 novembre;Moyenne;2 nuits;Petit pic si météo OK
16/11/2026;19/12/2026;Basse saison fin d'année;Basse;2 nuits;Période la plus creuse, jouer sur le prix
20/12/2026;03/01/2027;Noël / Nouvel An;Haute;3 nuits;Séjours fêtes, conditions strictes ménage/linge